comment,cleaned_comment
This was a great watch.,great watch
"Just a question how to we Insert Host Rna do we use Cas9 protein ?  


Also Second question how do add  host rna to DNA in the first place rna has ribose while DNA has Deoxyribose also rna has Uracil as its nitrogenous base instead of Thymine ?",question insert host rna use ca protein also second question add host rna dna first place rna ribose dna deoxyribose also rna uracil nitrogenous base instead thymine
Thank you good sir.. this really helped me for my presentation,thank good sir really helped presentation
"Filling the gap
No evidence showed regarding any allegation
Stop misleading people",filling gap evidence showed regarding allegation stop misleading people
I watched half a dozen videos so far on CRISPR and this video helped me piece everything together with enough details. Thank you very much,watched half dozen video far crispr video helped piece everything together enough detail thank much
AWESOME VIDEOOOOOOO!!!! LOVED IT,awesome videooooooo loved
I guess it could be used for bad ( weapons) and good ( healing).,guess could used bad weapon good healing
Shivin sir❤,shivin sir
https://www.youtube.com/watch?v=XmmnHWPHSwQ,
I hate science,hate science
Love  this video! Very handsome,love video handsome
They transformed it into a weaponized version eugenics and specifically to create altered versions of plagues in undesirable populations. Hope they don’t use it.,transformed weaponized version eugenics specifically create altered version plague undesirable population hope dont use
god I love you,god love
Great video!❤,great video
Wow,wow
I always come back to this video when I need a refresher on CRISPR. This video has it all. Thank you!,always come back video need refresher crispr video thank
Thank you for the discussion.,thank discussion
Your videos have helped me in every major step in my academic career. I am a 1st year medical student and still come back to your videos for help. Thank you so much for all that you do!,video helped every major step academic career st year medical student still come back video help thank much
Can someone tell me how this is done though? Like is a machine used?,someone tell done though like machine used
Not very clear.,clear
CRISPER IS A LIVING BEING,crisper living
Blestematilor .. focul lui Putin o sa va arda .nimic nu o sa ramana din dracoveniile voastre spurcate ..,blestematilor focul lui putin sa va arda nimic nu sa ramana din dracoveniile voastre spurcate
Thank you,thank
"8 years later your videos continue saving lives and degrees. Incredible explanations! Please, for the love of god and the hope of future generations, never take down your posts!!",year later video continue saving life degree incredible explanation please love god hope future generation never take post
"Great explanation, highly appreciated <3",great explanation highly appreciated
"Good job but i think have a mistake 

In any given bacterial strain, a CRISPR sequence inserted during the oldest infection is located farthest from the cas genes and the most recent is closest to the cas genes.",good job think mistake given bacterial strain crispr sequence inserted oldest infection located farthest ca gene recent closest ca gene
Thanks a lot after 8 years wow=),thanks lot year wow
Basically what it is is x men technology there is a price that comes with playing God. A half life,basically x men technology price come playing god half life
Cambridge AS and A level biology writers should come and have lecture from you and then rewrite the book,cambridge level biology writer come lecture rewrite book
very good explanation! thank you sir.,good explanation thank sir
THANK YOU SO MUCH !!!! loved every second of this,thank much loved every second
brilliant simple explanation,brilliant simple explanation
Am I allowed to invite you to my college graduation?,allowed invite college graduation
Have you guys heard about mitochondria ? Hint- its the Powerhouse of the cell,guy heard mitochondrion hint powerhouse cell
Genetics is insane… dystopian future incoming,genetics insane dystopian future incoming
thank you that was very helpful!!!,thank helpful
CRISPR has made its way to the general public in the form of a Sickle Cell treatment. Limited trials i believe.,crispr made way general public form sickle cell treatment limited trial believe
Stumbled across it during my breakfast and such a wonderful video it is. The concept is explained very lucidily.,stumbled across breakfast wonderful video concept explained lucidily
How come it's RNA binding to DNA ... Shouldn't it be DNA too to bind to bacteriophage DNA,come rna binding dna shouldnt dna bind bacteriophage dna
"GRACIAS, ni un solo video con el que pudiese entenderlo y ahora me ha quedado clarísimo 🫶🏻",gracias ni un solo video con el que pudiese entenderlo ahora ha quedado clarsimo
super helpful!!,super helpful
it was helpful:),helpful
"How would you target all of the cells?
Otherwise the gene we want to be silenced would only be removed from the cells we have targeted.",would target cell otherwise gene want silenced would removed cell targeted
"I'm not sure I'm 100% on exactly how it works, but you did a beautiful job of explaining the base concepts to a relatively unscientific shlub like me. Thanks!",im sure im exactly work beautiful job explaining base concept relatively unscientific shlub like thanks
This will inevitably lead to people getting cancer from using this via gene mutations. As if the radiation from CT scanners and adjuvants from the shots are not enough. Just more customers for the allopathic medicine industry,inevitably lead people getting cancer using via gene mutation radiation ct scanner adjuvant shot enough customer allopathic medicine industry
"Ahh,, ya. 
I totally get it now.
Thanks for the simple explanation.
So much clearer on that now.",ahh ya totally get thanks simple explanation much clearer
"My teacher adviced my entire class to watch this video for a better understanding, and now I can see why. You just saved my essay man, thank you!",teacher adviced entire class watch video better understanding see saved essay man thank
Amazing 🤩,amazing
Soooo helpful thank you!,soooo helpful thank
"As a biology student, this helped me so much. Amazing video!",biology student helped much amazing video
Hey I have a question (I hope you are still reading and replying to comments) - how do you  cure a disease whose gene is in every cell of the body? How do you replace and insert a new gene replacing the old one which was causing the disease in ALL the cells in the body,hey question hope still reading replying comment cure disease whose gene every cell body replace insert new gene replacing old one causing disease cell body
"Many have played Jenga or know the basics of displacement.
Before humans have a complete understanding of genetics and a true explanation for "" junk DNA"".
In my opinion, sciences ( generic) are run like a business and may theories are lacking in research, application and the red tape is snipped prematurely to hasten a contract or deal . Scary shit.",many played jenga know basic displacement human complete understanding genetics true explanation junk dna opinion science generic run like business may theory lacking research application red tape snipped prematurely hasten contract deal scary shit
"this was honestly very beautiful , ill need to rewatch it tho",honestly beautiful ill need rewatch tho
Great lecture and simplicity  explained 👌 🎉🎉😊 thanks,great lecture simplicity explained thanks
"I typically never leave comments on videos, but you really taught me an entire lecture and lecture video  that my teracher assigned. She's not a bad teacher i actually like her, but somehow not everything gets through. I was so shaky on the concept or the crispr system and didn't know what was what. Now i feel as though i have some illegal knowledge that the government will try to take me in for at some point in my life.",typically never leave comment video really taught entire lecture lecture video teracher assigned shes bad teacher actually like somehow everything get shaky concept crispr system didnt know feel though illegal knowledge government try take point life
Thanks!,thanks
loved it,loved
legend,legend
"As a first year med student, THANK YOU!",first year med student thank
"I have grade 10 biology education (though fairly smart). I've taken an interest in this thing and genetic modifications in general. This was very easy to follow. Can anyone recommend a more advanced thing though that goes over WHY it's cutting those genes (all the details - chemicals etc.), and more in detail about adding the new DNA?",grade biology education though fairly smart ive taken interest thing genetic modification general easy follow anyone recommend advanced thing though go cutting gene detail chemical etc detail adding new dna
"Helix superbug cure  /  use crisp cut the superbug into short chain with manageable size and do the short chain bug with drugs known to us ,   mioa",helix superbug cure use crisp cut superbug short chain manageable size short chain bug drug known u mioa
It is mega helpful.   THANKS A LOT,mega helpful thanks lot
The best video on the topic !!,best video topic
WOW. Amazinf. really hope that I get to study these kinda stuff at university.,wow amazinf really hope get study kinda stuff university
In a Bioformatics program internship. My instructor took hours,bioformatics program internship instructor took hour
CRISPR has the potential for life extension.,crispr potential life extension
They've created an artificial ribosomal sub unit😮,theyve created artificial ribosomal sub unit
THANK YOU FOR THIS. MY PROFESSOR TRIED EXPLAINING THIS IN 1.5 HRS BUT ITS ONLINE SO IT MAKES IT EVEN MORE ENTICING TO SLEEP. 1.5 HRS SAVED,thank professor tried explaining hr online make even enticing sleep hr saved
You're a rockstar,youre rockstar
"I really liked your video, I am an educator - teaching medical residents and students. Can you please share how you create animations for your videos. Thanks in advance. Dr Arora",really liked video educator teaching medical resident student please share create animation video thanks advance dr arora
Thanks for sharing this! it was awesome ;),thanks sharing awesome
"Thanks Mr Bozeman. Great explanation! I do have a question. If you want to heal a patient with a genetic disease, does the crispr-cas9 corrects one cell or all the cells? If it only heal one cell, how does the healed cell overcome other original cells?",thanks mr bozeman great explanation question want heal patient genetic disease crisprcas corrects one cell cell heal one cell healed cell overcome original cell
that was fantastic to summarize it in a very short time. thanks,fantastic summarize short time thanks
I watched 5 videos but still i was confused until i found your video and I understood everything finally 💖💖💖💖👏🏻👏🏻👏🏻👏🏻👏🏻👏🏻👏🏻👏🏻thank you,watched video still confused found video understood everything finally thank
Is it host DNA or RNA that is incorporated when inserting a gene? I believe both were said,host dna rna incorporated inserting gene believe said
"Well, this is really helpful. Thank you so much. ❤️",well really helpful thank much
love it,love
I would like permission to use this video in a presentation for our church livestream (on YouTube and our website).  How do I go about doing that?,would like permission use video presentation church livestream youtube website go
Blows my mind,blow mind
loove u,loove u
awesome explanation!,awesome explanation
found my new favourite channel,found new favourite channel
"Thanks for that exciting video, it was extremely informational. I am interested what is advantages of trcrRNA-crRNA chimera?",thanks exciting video extremely informational interested advantage trcrrnacrrna chimera
This was really helpful!,really helpful
AMAZING explanation!! Thank you!,amazing explanation thank
"there's one quastion ib my mind. If we use SCISPR-CAS  in human body, will our immune system react to foreign protein CAS9?",there one quastion ib mind use scisprcas human body immune system react foreign protein ca
that helpful. thanks for sharing.,helpful thanks sharing
Hmmmm... maybe this fancy CRISPR thinguhmajigger can help me grow my hair back,hmmmm maybe fancy crispr thinguhmajigger help grow hair back
thank you so much,thank much
"Best sir love from Pakistan 🇵🇰. 
Keep up the good work.",best sir love pakistan keep good work
"thank , informative video",thank informative video
thank you! finally got it,thank finally got
thank you it is a life saver. I have an exam tomorrow,thank life saver exam tomorrow
Is it really possible to reprogram dna in adults or is it only possible in embryo?,really possible reprogram dna adult possible embryo
"No no no, if you think it'll only be used fir good your so wrong. Greed money and power . This is horrific",think itll used fir good wrong greed money power horrific
Perfect!,perfect
"""Shut up and give me wolf ears!""",shut give wolf ear
Could this help ALS?,could help al
"I wonder for the modified CRISPR, when do the cutting of the original double stranded DNA, where did the original gene sequence go? Because it seem like the enzyme only cleave the DNA at specific location and not remove the desired gene that we want to replace",wonder modified crispr cutting original double stranded dna original gene sequence go seem like enzyme cleave dna specific location remove desired gene want replace
"Preparing for my med-sku interview tomorrow, I hope they'll ask me something about this so I could show off as a 17 year old. Lord bless me.",preparing medsku interview tomorrow hope theyll ask something could show year old lord bless
that is amazing yet terrifying. Genetically Modified Humans! Could someone inject me with a virus and have the crisper process started without my knowledge?,amazing yet terrifying genetically modified human could someone inject virus crisper process started without knowledge
That was very Interesting Thanks Paul Never thought i would have Understood or watched it till the end Thanks.,interesting thanks paul never thought would understood watched till end thanks
"You did a great job with this video, so much so that a layperson could grasp it. Thank you. Please do one on Oligodendroglioma brain tumors!",great job video much layperson could grasp thank please one oligodendroglioma brain tumor
Is the third part just an engineered linear strand? Or is that a plasmid? So do scientists put in both CRSPR and a linear DNA to gene edit a cell?,third part engineered linear strand plasmid scientist put crspr linear dna gene edit cell
I'm not an English speaker and I understood this video. Thank you very much for the explanation. It's very visual and that had helped me a lot. For more teachers like this guy :),im english speaker understood video thank much explanation visual helped lot teacher like guy
"Crisper will introduce something we don't want.   Sorry.   The introduction of what we have been seeing over the last 2 years is an attempt to control society on a grand scale. The individuals that are supposedly controlling everything that happens have a plan to regulate everything.  Mostly, how we function daily. Period.  
How?
Well, something has been introduced into us that we ran to recently because of a scare.  Ask yourself what was it?  Well, it shut down everything under the guise of health emergency people.  Why did they do this?  To control:
Population.
Banking
Health
Policing.  and even worship.
It will even recognize YOUR THOUGHT PROCESS!! 
Remember the Tom Cruise movie?  Minority Report?  
China has already pushed forward with the credit system that recognizes you at a drop of a hat!
DNA manipulation will be introduced into the human body from the next level of digital I.D.  this I.D. will recognize you!!!!
Anytime ""THEY"" want!!
CRISPR.
Yea.
Good Idea! 
Read your bible!!!",crisper introduce something dont want sorry introduction seeing last year attempt control society grand scale individual supposedly controlling everything happens plan regulate everything mostly function daily period well something introduced u ran recently scare ask well shut everything guise health emergency people control population banking health policing even worship even recognize thought process remember tom cruise movie minority report china already pushed forward credit system recognizes drop hat dna manipulation introduced human body next level digital id id recognize anytime want crispr yea good idea read bible
Thank you so much! That was super helpful!!!!,thank much super helpful
Can you invest in a company working on this?,invest company working
"Great, you have an amazing faculty to diseminate science. Congratulations",great amazing faculty diseminate science congratulation
The road to hell is paved with good intentions,road hell paved good intention
"Crispr this bitch 
(And I say b**** because I really actually admire how individuals can call each other b**** especially females and just be completely chill and cool about it and I have no ego or no desire to be better than one another or be hurt and this term of endearment becomes what sounds of the mouth have already meant to be and what intellects claim to be the persistent persute  of human  expression within the language should not suppress dynamic form of 
7 not just two vertical ⏸️ spired  line  in DNA with seven dimensions to each seven",crispr bitch say b really actually admire individual call b especially female completely chill cool ego desire better one another hurt term endearment becomes sound mouth already meant intellect claim persistent persute human expression within language suppress dynamic form two vertical spired line dna seven dimension seven
"I never write commentaries here on YT, but this time I need to do it to thank for this, I never understood de CRISP-Cas9 system till now!!! I'M SO HAPPY!!!
I know it's kind of ridiculous, but feels great to understand something you couldn't before. Now I can really read the paper and actually understand.

THANK YOU
THANK YOU
THANK YOU",never write commentary yt time need thank never understood de crispcas system till im happy know kind ridiculous feel great understand something couldnt really read paper actually understand thank thank thank
"You are so right about the level of videos in molecular biology. They either target primary school level, or PhD level. I don't see any molecular biology videos explaining staff for high school or BSc level",right level video molecular biology either target primary school level phd level dont see molecular biology video explaining staff high school bsc level
Kinda like a epigentic spacer,kinda like epigentic spacer
Do you still answer your comments?,still answer comment
totally helpful,totally helpful
Does tracrRNA have any function other than to hold stuff in place?,tracrrna function hold stuff place
"I went over the CRISPR system today with my students, had them model it with the Bio-Rad paper model, now I'm going to make an Ed-Puzzle using this video as formative before we actually do a CRISPR experiment in class (lacZ gene knockout). Thank you for this in depth video on CRISPR!",went crispr system today student model biorad paper model im going make edpuzzle using video formative actually crispr experiment class lacz gene knockout thank depth video crispr
Why am I paying for university,paying university
Medical student here. Nicely done Mr. Anderson!,medical student nicely done mr anderson
I still don’t understand it,still dont understand
"Loved this explanation, thank you!",loved explanation thank
Awesome video! Thanks for making it.,awesome video thanks making
GOOD!!,good
What part of it changes you do you not understand,part change understand
Now i could understand! Thank you <3,could understand thank
Tried explaining this in my podcast where I go over CRISPR technology but you explained this perfectly thank you!,tried explaining podcast go crispr technology explained perfectly thank
Nice Many Thanks,nice many thanks
Cool video! Thanks :),cool video thanks
6:27 can someone explain in more detail how the DNA is added?,someone explain detail dna added
How do u manage to insert a new fragment after the cutting? Is there a particular DNA ligase associated with the CAS complex?,u manage insert new fragment cutting particular dna ligase associated ca complex
Can we just be humane humans...😨😨😨,humane human
speaker talks a little too fast,speaker talk little fast
"Very well explained, I had trouble understanding this topic during lecture. Thx",well explained trouble understanding topic lecture thx
nice,nice
And the recap at the end. Thanks so much! Very helpful,recap end thanks much helpful
4 words - YOU ARE THE BEST	111,word best
Mind-blowing simple demonstration of the crispr cas.... 🔥🔥🔥,mindblowing simple demonstration crispr ca
very helpful! took me a long time to understand what's spacer DNA and what are repeats from only reading.. watching the video really summarized it all. not so simple and not so complicated. just what you really want to know,helpful took long time understand whats spacer dna repeat reading watching video really summarized simple complicated really want know
This is perfect.  THANK YOU!,perfect thank
"The mad scientist really opened Pandor's Box with this one.  Rewriting millions of years of evolution cannot  be good.  This technology should have been top secret.  These individuals were more interested in fame and furtune then the impact it will have on the world 🌎   China is now utilizing this technology.  They recently built concentrations camps, could be bio-laboratories.  Humans are not yet wise enough to wield such power.  We're not going to make it, too many wrong turns.",mad scientist really opened pandors box one rewriting million year evolution good technology top secret individual interested fame furtune impact world china utilizing technology recently built concentration camp could biolaboratories human yet wise enough wield power going make many wrong turn
Awsome Video! Thanks for the effort! Much appreicated and so helpful!,awsome video thanks effort much appreicated helpful
how can I grow taller or cure hair loss from this? I ready to take the risks.,grow taller cure hair loss ready take risk
"Wow soo this is CRISPR...
Makes sense to make a fuss for it cause it really has a potential. 
But if it starts being used to make modified humans like super soliders... woooah it could be devastating",wow soo crispr make sense make fuss cause really potential start used make modified human like super soliders woooah could devastating
Whats this tech used for now?,whats tech used
"CRISPR, another failed miracle cure.",crispr another failed miracle cure
Thank you that was very clarifying!,thank clarifying
Thank you Steve Kerr,thank steve kerr
What a great explanation....excellent lecture🔥🔥,great explanationexcellent lecture
"use it on clostridium difficilewhich really sucks to come down with, that might eliminate fecal trans plants.",use clostridium difficilewhich really suck come might eliminate fecal trans plant
"As far as I know the CRISPR virus causes a fever which has killed a lot of people and is the major risk factor. Immunotherapy has that risk but I hope they are really working to counter that as it a good way to remove genetic diseases from the dna of cells or repair cancerous cells and will be a good tool to help people survive. Until a machine can exist that can program dna externally and destroy cells which is far away, using some kind of qauntum non destructive computer controlled radiation streams.",far know crispr virus cause fever killed lot people major risk factor immunotherapy risk hope really working counter good way remove genetic disease dna cell repair cancerous cell good tool help people survive machine exist program dna externally destroy cell far away using kind qauntum non destructive computer controlled radiation stream
I love your videos!! you should do reviews for MCAT material!,love video review mcat material
"I watched this for my school activity and I have to rewatch it over and over to understand since I'm very slow. But it is TOTALLY HELPFUL, with all the illustrations and the explanations. Thank you!",watched school activity rewatch understand since im slow totally helpful illustration explanation thank
great explanation! I finally understood what CRISPR really is. Now I'm ready to learn more!,great explanation finally understood crispr really im ready learn
What a simple and clear explanation! Thank you very much!,simple clear explanation thank much
crRna is like a sea otter chipping its prey in two with a stone it holds in its tiny hands whilst floating on its back in the sea,crrna like sea otter chipping prey two stone hold tiny hand whilst floating back sea
Verry helpful and a welcome addition to the shows seen on PBS.,verry helpful welcome addition show seen pb
this was the most amazing explanation. I completely understand now,amazing explanation completely understand
Awesome job! I'm taking genetics right now and this really helped my understanding the material,awesome job im taking genetics right really helped understanding material
It is a great video and understandable. I considered this topic complex until I saw this video. Thank you for sharing,great video understandable considered topic complex saw video thank sharing
Nice! Thank you!,nice thank
