comment,cleaned_comment
"The Earth is ridding its self of humanity. This is just the very first few seconds of the catastrophe to follow. This is the Earths sixth extinction event. No one can stop evolution. It continues on into the future. After the heat of climate change has done its job the Earth will go through another ice age. After the ice age is over the Earth will emerge pure and cleansed again and from there every thing will start over. The purity of the Garden of Eden will return as evolution does its job. This time there will be no humans nor any monkeys nor anything that could evolve into any human form. 10 million years will have passed and entirely new forms of species will now inhabit the Earth. Nothing Humans try to do will change anything. The future will not be changed.
This is the vision that I saw in a meditation. The vision was shown to my minds eye as clear as any television picture where I beheld the future of mankind and of the Earth. Robert McKellar-Ellis.",earth ridding self humanity first second catastrophe follow earth sixth extinction event one stop evolution continues future heat climate change done job earth go another ice age ice age earth emerge pure cleansed every thing start purity garden eden return evolution job time human monkey anything could evolve human form million year passed entirely new form specie inhabit earth nothing human try change anything future changed vision saw meditation vision shown mind eye clear television picture beheld future mankind earth robert mckellarellis
What about when a volcano erupts? Is that a massive Co2/metan disaster for the climate?,volcano erupts massive cometan disaster climate
Hmmm. Do you think that all of the jets and bombs and explosions in WARS might be largely responsible at all? Just saying…,hmmm think jet bomb explosion war might largely responsible saying
"Climatards, lol.",climatards lol
"We already averted catastrophe, and it was a remarkably perfect, zero! 
In the 70s and 80s we saw it coming. America acted with emission policy and ban on things like Freon, aerosol hairspray etc. We averted the worst of the worst catastrophic climate predictions.",already averted catastrophe remarkably perfect zero saw coming america acted emission policy ban thing like freon aerosol hairspray etc averted worst worst catastrophic climate prediction
"If the world doesn't map out the way to create the durable wealth to pay for the infrastructure, it's time to go down to the Y and take swimming lessons and  stop whinnying!",world doesnt map way create durable wealth pay infrastructure time go take swimming lesson stop whinnying
Download Ecosia  💚,download ecosia
what can i say? it's catchy,say catchy
BS,b
We all are chasing for money.anyone no need to stop and nobody need to be content .finally we all are togeter digging our own graves.,chasing moneyanyone need stop nobody need content finally togeter digging graf
Oh my African people 😭😭😭😭,oh african people
Earth is not Sick...Earth is adjusting itself to eliminate man...,earth sickearth adjusting eliminate man
"Chinese electric vehicles are often marketed as environmentally friendly, yet they rely heavily on electricity generated from coal, making their true carbon footprint far from ""green."" While they produce no direct emissions, their operation is still largely powered by fossil fuels.  

Despite this, the Chinese Communist Party (CCP) promotes its EV industry as a leader in sustainability, conveniently ignoring the fact that China remains the world's largest carbon emitter. By branding these vehicles as ""eco-friendly,"" China profits from global environmental concerns while continuing to rely on coal.  

Moreover, the CCP has a long history of controlling information, from covering up the Tiananmen Square massacre, where 30,000 students were killed, to suppressing any narratives that challenge its official stance. As a result, many Chinese citizens genuinely believe their EVs are helping the environment, unaware of the broader reality.  

Consumers who truly care about sustainability should consider whether buying an EV powered by coal-generated electricity aligns with their values. Supporting products from countries that prioritize clean energy may be a more effective way to fight climate change.",chinese electric vehicle often marketed environmentally friendly yet rely heavily electricity generated coal making true carbon footprint far green produce direct emission operation still largely powered fossil fuel despite chinese communist party ccp promotes ev industry leader sustainability conveniently ignoring fact china remains world largest carbon emitter branding vehicle ecofriendly china profit global environmental concern continuing rely coal moreover ccp long history controlling information covering tiananmen square massacre student killed suppressing narrative challenge official stance result many chinese citizen genuinely believe ev helping environment unaware broader reality consumer truly care sustainability consider whether buying ev powered coalgenerated electricity aligns value supporting product country prioritize clean energy may effective way fight climate change
People want change and we should be working hard to meet the change that the climate and environment needs 👍👍,people want change working hard meet change climate environment need
"Normal people who are the consumers can’t do anything about the CC, the ones that can do something focus on two things primary: keeping the people poor so they can control them and keeping the people with fear so people can be manipulated.
Me and you we can’t do shit.",normal people consumer cant anything cc one something focus two thing primary keeping people poor control keeping people fear people manipulated cant shit
The stabil energi and a move dynam mechine for the to eternity where three unfade pleassan,stabil energi move dynam mechine eternity three unfade pleassan
Rumour has it that in five years  time we are all gonna need boats!,rumour five year time gon na need boat
"If you wish to switch from fossil fuels mankind needs to enable the solution to fix the shortcomings of the source of energy.  God gave mankind the source and 2 down stream steps that enabled energy to be stored, distributed, and called back on demand as needed.  Mankind will need to do likewise with another thing God  did for mankind in Genesis 1:26-28 make mankind in His likeness.  God gave us the privilege of ço-creating the world we live in.",wish switch fossil fuel mankind need enable solution fix shortcoming source energy god gave mankind source stream step enabled energy stored distributed called back demand needed mankind need likewise another thing god mankind genesis make mankind likeness god gave u privilege ocreating world live
Plss give me the summary of this video,plss give summary video
Biggest Scam in the History of Humanity,biggest scam history humanity
"June 18, 2024News Release
City Sprawl Now Large Enough to Sway Global Warming Over Land

Urban land now reaches farther than ever, and so too does its influence on global warming

Brendan Bane, PNNL Catie Himes, PNNL
The glowing orange Sun shines over a lightly hazy Paris, the Eifel Tower standing erect, just right of center-frame.
Open
Cities have grown quite a lot in recent decades—global urban land cover has swelled by 226 percent since 1992. As city sprawl expands its reach, its influence on the world's climate grows in tandem.",june news release city sprawl large enough sway global warming land urban land reach farther ever influence global warming brendan bane pnnl catie himes pnnl glowing orange sun shine lightly hazy paris eifel tower standing erect right centerframe open city grown quite lot recent decadesglobal urban land cover swelled percent since city sprawl expands reach influence world climate grows tandem
"Without having more products to spread the cost over of the required infrastructure the 1st world economies have no prayer to replace fossil fuels.
God gave mankind the source of energy and 2 steps down line.  Mankind will have design ways to store, distribute, make additional products to spread the cost of infrastructure over and increase the value of low value assets into durable high value ones.
It will take both Elon Musk and President Trump to enable all investors win to transfer from fossil fuels.  I would love to invite them to share my insight.",without product spread cost required infrastructure st world economy prayer replace fossil fuel god gave mankind source energy step line mankind design way store distribute make additional product spread cost infrastructure increase value low value asset durable high value one take elon musk president trump enable investor win transfer fossil fuel would love invite share insight
"Not human made but perhaps 5-10%. It is the current Magnetic Excursion that been on a straight line move since 1850. Distorting, weakening the magnetic field allowing the sun radiance of the sun to penitrate stronger into the planet. Thus the melting of the ice caps. It's nature, not humans. Polution is bad but not the cause. Adjust your narrative.",human made perhaps current magnetic excursion straight line move since distorting weakening magnetic field allowing sun radiance sun penitrate stronger planet thus melting ice cap nature human polution bad cause adjust narrative
"Wow that nice 
Wonderful 
Like from India",wow nice wonderful like india
I love cutie pie GA sheriff..not them..Did you know Chinas most polluted country?,love cutie pie ga sheriffnot themdid know china polluted country
If the Europeans will leave Africa alone there will be nothing like climate change,european leave africa alone nothing like climate change
"*""In the last 30 years, CO2 emissions have increased by 60 percent worldwide. The most pressing problem facing our civilization is global warming.""*  Except that data proves, we've never been safer, healthier or more prosperous than at any time in history.",last year co emission increased percent worldwide pressing problem facing civilization global warming except data prof weve never safer healthier prosperous time history
"“Global warming” refers to the rise in global temperatures due mainly to the increasing concentrations of greenhouse gases in the atmosphere. “Climate change” refers to the increasing changes in the measures of climate over a long period of time – including precipitation, temperature, and wind patterns.",global warming refers rise global temperature due mainly increasing concentration greenhouse gas atmosphere climate change refers increasing change measure climate long period time including precipitation temperature wind pattern
"You talk about russia and global warming, but the russians are killing humanity without the impact of global warming.",talk russia global warming russian killing humanity without impact global warming
Hydro energy isn’t green,hydro energy isnt green
Poor doesn’t care about the climate change. Only rich do.,poor doesnt care climate change rich
"But Al Gore told us the poles would melt by 2015? The polar bears would disappear???

But I am under 30 feet of snow in california in 2025???",al gore told u pole would melt polar bear would disappear foot snow california
Climate change means Jesus Christ is coming back.,climate change mean jesus christ coming back
A year later and  it’s looking like the small progress made is being rolled back. The course is set and our ultra cynical governments are preparing to accept the destruction and keep on fighting to dominate whatever they imagine will left from the dystopia. Trump wanting to confiscate Greenland being a prime example of this moronic vision…,year later looking like small progress made rolled back course set ultra cynical government preparing accept destruction keep fighting dominate whatever imagine left dystopia trump wanting confiscate greenland prime example moronic vision
"Watching this I am asking myself, do any of these smart individual remember the carbon cycle and all the components in it. 
Do they remember that trees are responsible to take carbon dioxide out of the atmosphere and return Oxygen.
Is it not smarter to invest all those billions in replanting back trees in areas and countries where desert exist.
For those who is even thinking about mention, how trees take a 1000 years to grow. 
I am asking you, did you ever plant a tree? 
A forest tree takes about 7- 14 days for it's seed to germinate and will take about 3 - 4 years to reach an average height of 15 - 20 feet. 
I know because I proven this.
If we all know that trees are the natural remover of carbon dioxide, why is the billions not being invested to replant them?",watching asking smart individual remember carbon cycle component remember tree responsible take carbon dioxide atmosphere return oxygen smarter invest billion replanting back tree area country desert exist even thinking mention tree take year grow asking ever plant tree forest tree take day seed germinate take year reach average height foot know proven know tree natural remover carbon dioxide billion invested replant
What a difference a year makes.,difference year make
Helicoptering water in when theres pipes on the tank do you think were all blind.,helicoptering water there pipe tank think blind
"Rising sea levels... Tropical rain  are you guys joking 
How long can this story go on for",rising sea level tropical rain guy joking long story go
"How do all these experts, know how bad the weather was 300/4,5 hundred years ago??? They don’t.. They can look at the earth, and give their carbon dating! But what will be will be.",expert know bad weather hundred year ago dont look earth give carbon dating
"😂😂😂
So the rain deer and horses are different from cows?",rain deer horse different cow
"why are you lying to the children about climate change when all climates on sarth have evolved over time and have stayed the same since before fossil fuels were used?
find courage to tell the truth. show videos of polar ice melting as well as forming. don’t claim they are melting for so long and yet never stop melting.",lying child climate change climate sarth evolved time stayed since fossil fuel used find courage tell truth show video polar ice melting well forming dont claim melting long yet never stop melting
...and the poor ofteen  pray for soft winter ans long and prosper sumers,poor ofteen pray soft winter an long prosper sumer
"Overpopulation is the problem in the 3rd world, not climate change.",overpopulation problem rd world climate change
I used to think climate change was a myth. As a kid remembered the glaciers had way more ice. But its melting at a rapid pace.,used think climate change myth kid remembered glacier way ice melting rapid pace
We have to put it on hold for the next 4 years .Some big players are climate change deniers !!!,put hold next year big player climate change denier
Hola,hola
"I'm okay with government policy based on science, on fact. But I object to policies based on this climate change propaganda nonsense. The small changes happening over the last few hundred years are natural, not human caused. What we need to focus on, as we have, is pollution prevention, management of natural resources. CO2 is required for life on the planet, if you remember high school science. CO2 circulates between the ground, ocean and atmosphere. We are coming off a planet low of CO2 and would be better with more for higher plant food production. Water vapor is the dominant greenhouse gas, basic science. Look in your car radiator, no CO2, but water for heat transfer and storage.",im okay government policy based science fact object policy based climate change propaganda nonsense small change happening last hundred year natural human caused need focus pollution prevention management natural resource co required life planet remember high school science co circulates ground ocean atmosphere coming planet low co would better higher plant food production water vapor dominant greenhouse gas basic science look car radiator co water heat transfer storage
"You can't even stop diesel vehicles production,and missle tezt",cant even stop diesel vehicle productionand missle tezt
God help us,god help u
The biggest scam of the 21st century! LOL,biggest scam st century lol
"Load of hot air. Climate change has been happening since the world existed. Minuscule (and unproven) rise in global temperatures of less than one degree in 100 years (with potentially 20 percent due to human influence) has more to do with cleaner air and lesss smoke. In any case, I wish it would heat up a bit more. I would burn more carbon to assist this process if I didn’t know it would have no effect whatsoever. At least the ISA will escape this nonsense when Trump puts a line through it. Europe will not be so lucky and will continue to pay for nothing and continue to ruin their own manufacturing and industry.",load hot air climate change happening since world existed minuscule unproven rise global temperature less one degree year potentially percent due human influence cleaner air lesss smoke case wish would heat bit would burn carbon assist process didnt know would effect whatsoever least isa escape nonsense trump put line europe lucky continue pay nothing continue ruin manufacturing industry
"A Climate Remediation Suggestion

	There is a lot of discussion about Global Warming, whether it really exists, how serious a threat and the role of Carbon Dioxide. However, the following is generally agreed. Namely that a lot of CO2 has been released into the atmosphere since the start of the Industrial Revolution and a lot of it has ended up in solution in sea waters. There is at least 150 times as much CO2 in a cubic meter of sea water as there is in a cubic meter of atmosphere at NTP. This is acidifying the sea waters and possibly harming Coral Reefs and other fauna. There has also been some agreement that the Temperature of the Earth has warmed somewhat.
	The Earth's rotation and the Coriolis Effect has formed a number of Tropical/Semi-Tropical Oceanic Gyres, within which the mass of sea water is rotating, clockwise in the Northern Hemisphere and counter clockwise in the Southern Hemisphere. Anything floating, i.e., less dense than sea water tends to float towards the center of the Gyre. There are five main Gyres all of which are Tropical/Semitropical. They are the North Pacific, South Pacific, Indian, North Atlantic, and South Atlantic Oceans. Together they form a very large proportion of the 70% of the Earth's surface which is covered by water.
	The North Pacific has a lot of floating debris, ""the Great Pacific Garbage Patch"", some of it being debris washed off Japan by tsunamis following the recent Fukishima Earth Quake. The Southern Hemisphere Gyres do not appear to contain much floating debris.
	The North Atlantic Gyre is unique. It contains the Sargasso Sea which is characterized by the presence of two species of Sargassum which float by virtue of oxygen-filled follicles. It was discovered (first documented) by Columbus from his voyage in 1492. There is a Sargasso Sea Commission, with an Office in Washington DC, which is charged with protecting the Sargasso Sea from pollution etc. There is a website that basically describes all of the positive ecological values of the Sea.
	Since 2011 the Sargassum appears to be overflowing from the Sargasso Sea and moving via the west bound currents across the north coast of South America into the Caribbean and sometimes into the Gulf of Mexico. This has been attributed to agricultural run off from the USA or Brazil but might be due to the increased levels of CO2 in solution.
	It has been washing up on beaches through out this region, as one might expect to happen. When it dies and rots it emits H2S. Since a lot of these beaches have tourism as their main industry, the weed has to be removed manually which has given Sargassum a bad name. There are several Facebook entities that keep track of Sargassum landings and there are frequent postings enquiring about Sargassum occurrence on specific tourist areas.
	The occurrence of Sargassum in the Caribbean would, however, make it very easy to put live Sargassum into the Pacific off the west coast of Mexico. From there the currents would carry it all the way across the Pacific, photosynthesizing and growing all the way absorbing a lot of CO2 and heat energy, photosynthesis is an endothermic reaction. Absorbing CO2 from the Ocean would allow CO2 from the Atmosphere to dissolve in the sea. The Sargassum would probably stay in the North Pacific Gyre but some might drift into the South Pacific.
	One might balk at the idea of covering a lot of the Oceans with Sargassum but it does have uses. It can be used to make ethanol, paper or cardboard. Some one in the Caribbean is making construction bricks from it and others are feeding it to goats..
	If there appears to be some benefit from Pacific Sargassum we could easily add Sargassum to the other Gyres using ships that are transiting the Panama Canal. It seems likely that some Sargassum will eventually get into the South Atlantic Gyre, but that may take a while.

I would welcome any thoughts. Robert O Ducharme (rodincus@aol.com).",climate remediation suggestion lot discussion global warming whether really exists serious threat role carbon dioxide however following generally agreed namely lot co released atmosphere since start industrial revolution lot ended solution sea water least time much co cubic meter sea water cubic meter atmosphere ntp acidifying sea water possibly harming coral reef fauna also agreement temperature earth warmed somewhat earth rotation coriolis effect formed number tropicalsemitropical oceanic gyre within mass sea water rotating clockwise northern hemisphere counter clockwise southern hemisphere anything floating ie less dense sea water tends float towards center gyre five main gyre tropicalsemitropical north pacific south pacific indian north atlantic south atlantic ocean together form large proportion earth surface covered water north pacific lot floating debris great pacific garbage patch debris washed japan tsunami following recent fukishima earth quake southern hemisphere gyre appear contain much floating debris north atlantic gyre unique contains sargasso sea characterized presence two specie sargassum float virtue oxygenfilled follicle discovered first documented columbus voyage sargasso sea commission office washington dc charged protecting sargasso sea pollution etc website basically describes positive ecological value sea since sargassum appears overflowing sargasso sea moving via west bound current across north coast south america caribbean sometimes gulf mexico attributed agricultural run usa brazil might due increased level co solution washing beach region one might expect happen dy rot emits h since lot beach tourism main industry weed removed manually given sargassum bad name several facebook entity keep track sargassum landing frequent posting enquiring sargassum occurrence specific tourist area occurrence sargassum caribbean would however make easy put live sargassum pacific west coast mexico current would carry way across pacific photosynthesizing growing way absorbing lot co heat energy photosynthesis endothermic reaction absorbing co ocean would allow co atmosphere dissolve sea sargassum would probably stay north pacific gyre might drift south pacific one might balk idea covering lot ocean sargassum us used make ethanol paper cardboard one caribbean making construction brick others feeding goat appears benefit pacific sargassum could easily add sargassum gyre using ship transiting panama canal seems likely sargassum eventually get south atlantic gyre may take would welcome thought robert ducharme rodincusaolcom
Climate change are man made n not important to the world organization  if it was important the world organization must hire people to plant trees on desert,climate change man made n important world organization important world organization must hire people plant tree desert
Over population.  Over consumption.  Ignorance.  Don't want to be a doomer but am and it's rough on my mental well-being.,population consumption ignorance dont want doomer rough mental wellbeing
What if the earth is trying to wipe out humanity so it can have a fresh start away from the bs people have done,earth trying wipe humanity fresh start away b people done
"Climate change refers to significant and lasting changes in the Earth's climate, especially an increase in temperature and changes in weather patterns, primarily due to human activities like burning fossil fuels, deforestation, and industrial processes.The primary greenhouse gases that are currently increasing in the atmosphere due to human activities are carbon dioxide (CO2), methane (CH4), and nitrous oxide (N2O)

1. Burning fossil fuels
2. Cutting down forests
3. Farming livestock
are all increasingly influencing the climate and the earth's temperature. This adds enormous amounts of greenhouse gases to those naturally occurring in the atmosphere, increasing the greenhouse effect and global warming.",climate change refers significant lasting change earth climate especially increase temperature change weather pattern primarily due human activity like burning fossil fuel deforestation industrial processesthe primary greenhouse gas currently increasing atmosphere due human activity carbon dioxide co methane ch nitrous oxide burning fossil fuel cutting forest farming livestock increasingly influencing climate earth temperature add enormous amount greenhouse gas naturally occurring atmosphere increasing greenhouse effect global warming
