comment,cleaned_comment
"What if you choose based on who you feel you are/ want to become, and it still doesn't work out, based on factors you couldn't foresee: an example, a few years ago I adopted a ten year old rescue dog, it was taking a leap of faith because I have 5 beloved cats at home (but love dogs and used to have them until they died of old age) -- I brought the rescue dog home and it became clear, despite going about the introductions in as slow a way as I had read was necessary/ separating them but allowing them to see one another etc., the dog would have killed my cats (despite being told at the shelter he was good with cats). I contacted a trainer to see what was possible and she said it was unsafe since the dog was older, this cat reactivity was unlikely to change and even if it could it would be a long stressful time for the cats and the dog, and I should bring the dog back to the shelter. This was something unimaginable but what I ended up having to do for the safety of my cats and also so the dog could have a chance at a loving, cat free home. Now, if I want to try to adopt a dog again, and choose based on who I am/ want to become, which is an animal lover who wants to say ""yes"" to animals who need a home as long as I can keep up with all their needs, I have this past experience that tells me, you can choose based on your own becoming but it doesn't necessarily mean it will feel like the better choice once the unforeseens become visible. Yes, any experience is growthful, but I guess I wish the speaker could have spoken a bit to this kind of thing, the unforeseens....",choose based feel want become still doesnt work based factor couldnt foresee example year ago adopted ten year old rescue dog taking leap faith beloved cat home love dog used died old age brought rescue dog home became clear despite going introduction slow way read necessary separating allowing see one another etc dog would killed cat despite told shelter good cat contacted trainer see possible said unsafe since dog older cat reactivity unlikely change even could would long stressful time cat dog bring dog back shelter something unimaginable ended safety cat also dog could chance loving cat free home want try adopt dog choose based want become animal lover want say yes animal need home long keep need past experience tell choose based becoming doesnt necessarily mean feel like better choice unforeseens become visible yes experience growthful guess wish speaker could spoken bit kind thing unforeseens
If you are watching this in 2022. Look both ways movie on Netflix is the perfect example. Looks to me like the writer of the movie watched this YouTube video 🫠,watching look way movie netflix perfect example look like writer movie watched youtube video
"Ruth Chang says that hard choices are hard because none of the alternatives is way better than the other. Therefore, even small choices can be hard. Whether to have chocolate ice cream or creme brulee can be a very hard choice indeed, if I like them both and if I am craving for sweets at that moment.  So what do we do? We take the safest option.

We decide to become engineers than artists because statistically, the probability of getting a job as an engineer is higher than that of an artist. So, we take the safest option, because we fear that we are too stupid to understand the better option if the choice to make is hard. We prefer not to take any risks and we go for the option that is rationally comforting.

This is the very mistake we make. Remember, in hard choices no option is better than the other. We simply do not know…How can we know that engineering makes us happier in our future lives? Unfortunately, there are no fast forward and rewind buttons for life. So, does it really make sense to conclude that engineering is the better option? It's not and whether we like it or not at the end of the day hard choice is the only way to make our life easier. How ironic.",ruth chang say hard choice hard none alternative way better therefore even small choice hard whether chocolate ice cream creme brulee hard choice indeed like craving sweet moment take safest option decide become engineer artist statistically probability getting job engineer higher artist take safest option fear stupid understand better option choice make hard prefer take risk go option rationally comforting mistake make remember hard choice option better simply knowhow know engineering make u happier future life unfortunately fast forward rewind button life really make sense conclude engineering better option whether like end day hard choice way make life easier ironic
"Ruth Chang says that there is something we have misunderstood about hard choices. These are not a source of agony, a reason for sorrowful days or sleepless nights. Instead, these are chances for us to personally grow as human beings. “Understanding hard choices helps us uncover a hidden power that each one of us possesses.”",ruth chang say something misunderstood hard choice source agony reason sorrowful day sleepless night instead chance u personally grow human being understanding hard choice help u uncover hidden power one u possesses
"Don't try to make the right decision, make the decision right.",dont try make right decision make decision right
How to make hard choices? Shouldn't we be asking men this question? 🤣 😧,make hard choice shouldnt asking men question
This was really a very inspiring talk and I‘m truly amazed by it. And I believe that in the future I will be able to think that way about hard choices. Unfortunately I still can’t make the one I‘m struggling with right now. The safe option is not a 100% what I really want but it would be the most logical one. On the other hand the option that I fear in some ways would mean giving up everything and I think this one could be the one I could regret. So I can either choose something I know I won’t be really happy about or I can choose the one that I might regret,really inspiring talk im truly amazed believe future able think way hard choice unfortunately still cant make one im struggling right safe option really want would logical one hand option fear way would mean giving everything think one could one could regret either choose something know wont really happy choose one might regret
"Brilliant 👏 👏 
Ask yourself  a simple  question: Is the choice  you are about  to make will expand you and you will  grow?

Then ask yourself  another  one:
What will I  do  if I have 6 months  to live?
... same answer don't  think so...

What If you  eventually  understand  that   the choice  you are about  to make has already been  done by you in another  parallel  reality ? Actually  you finally  got it you just imagine  you have  a choice.  Well  you don't.

Have  a  lovely  day to all of us",brilliant ask simple question choice make expand grow ask another one month live answer dont think eventually understand choice make already done another parallel reality actually finally got imagine choice well dont lovely day u
Thank you for this video,thank video
I dont think she really answer the questions,dont think really answer question
I hate how most of the ted talks are like 98% defining the question or problem and the rest 2% is about the answer that i never get to comprehend ughh,hate ted talk like defining question problem rest answer never get comprehend ughh
This was explained really well !,explained really well
"Like Kramer, I too always wanted to be a banker.",like kramer always wanted banker
"Very helpful, was just deciding whether to leave a place or to commute and was making a reasons why not to move, while everyone around me just pushed me to save money. You are changing my life! Thank you",helpful deciding whether leave place commute making reason move everyone around pushed save money changing life thank
"TO HONESTLY KNOW WHO WANT TO BE, YOU NEED TO KNOW WHO YOU CAN BE. TO DO THAT YOU HAVE TO SEE YOURSELF FOR WHO YOU TRULY ARE (EASIER SAID THAN DONE). 
You must honestly answer the question: ""Is this something I have the ability to do well in?"" A 70 year old blind man, choosing to become a blackbelt in Taekwondo will always be a bad/impossible choice.",honestly know want need know see truly easier said done must honestly answer question something ability well year old blind man choosing become blackbelt taekwondo always badimpossible choice
Wow. Just wow. I never thought I would benefit from a TED talk as much as I did from this one. I won't be a drifter. Thank you for sharing your wisdom 🙏,wow wow never thought would benefit ted talk much one wont drifter thank sharing wisdom
"So basically if you know yourself, the choices would be easier.",basically know choice would easier
"Let’s have some Ignatian Discernment, shall we?!",let ignatian discernment shall
"This is wonderful advice, but for some choices money always gets in the way of my decisions",wonderful advice choice money always get way decision
Hay personas que no toman sus propias decisiones y eso también las convierte en lo que son.,hay persona que toman sus propias decisiones eso tambin la convierte en lo que son
"For anyone doing the assignment:
According to the video's content, hard choices give us the power to become who we are.
 TRUE

Facing hard choices is about the best _______ given to us.

ALTERNATIVES

A _______ is the term Ruth Chang uses to describe an individual who allows the world, instead of herself or himself, to write their story of how to make decision.

DRIFTER",anyone assignment according video content hard choice give u power become true facing hard choice best given u alternative term ruth chang us describe individual allows world instead write story make decision drifter
"8 years later this TED talk is what I needed. Deep down we know, we just need to be true to ourself and confident even if it’s scary af",year later ted talk needed deep know need true ourself confident even scary af
Thanks mam I needed it,thanks mam needed
"Wow. Such a paradigm shift in thinking... That the choices we make come from the reasons we give ourselves to make a choice. 

And that drifters (guilty as charged) make choices or have difficulty to based on reasons outside of ourselves (fear, others' expectations, punishment/reward).

I feel like I could watch this multiple times and get something new out of it.",wow paradigm shift thinking choice make come reason give make choice drifter guilty charged make choice difficulty based reason outside fear others expectation punishmentreward feel like could watch multiple time get something new
Thank you Mrs. Chang. What a wonderful speech. Maria Stefanidi,thank mr chang wonderful speech maria stefanidi
Well that was a pointless watch,well pointless watch
No dress sense here.,dress sense
"How about using JWST to check out “Tabby’s Star”? Supposedly, it has a range of 13.5 BILLION light years. If so it should be a very simple answer to be discovered, unless there is something they don’t want us to know like, JWST doesn’t work and was a waste of money, OR maybe, just maybe, astronomy itself is a waste of money, that could be used to actually help people on this planet.",using jwst check tabby star supposedly range billion light year simple answer discovered unless something dont want u know like jwst doesnt work waste money maybe maybe astronomy waste money could used actually help people planet
YOU WILL BECOME THE EARLIN  IN FUTURE.,become earlin future
"A ""Dyson sphere"" is the dumbest astrophysics hypothesis in all of human history. As for this particular star, ""We don't know what is going on, but we're working on finding out,"" is sufficient. 

Maybe it's a fleet of space-busses taking extraterrestrial ""children"" to space-school, and the long pauses between events are Spring and Summer Break? 

That's at least as good a hypothesis as a Dyson sphere.",dyson sphere dumbest astrophysics hypothesis human history particular star dont know going working finding sufficient maybe fleet spacebusses taking extraterrestrial child spaceschool long pause event spring summer break thats least good hypothesis dyson sphere
"The theory of Dyson spheres is at best absurd, at worst, ludicrous.
To think that a civilisation capeable of constructing a mega structure around it's star to capture energy,
Would endeavour to do so, while other forms of limitless energy would be available to that advanced civilisation,
Is plain silly.
We, here, now, are on the verge of fusion energy, limitless cheap energy,
Other more exotic energy will be available within the next one hundred years.
The mere construction around a star would probably use all of the material from dozens of planets, the length of construction measured in thousands of years,
Whatever planets remained in those solar systems would see dramatic, maybe even catastrophic falls in sunlight, weather pattern carnage, and eco systems collapse.
Dyson spheres are nonsense.",theory dyson sphere best absurd worst ludicrous think civilisation capeable constructing mega structure around star capture energy would endeavour form limitless energy would available advanced civilisation plain silly verge fusion energy limitless cheap energy exotic energy available within next one hundred year mere construction around star would probably use material dozen planet length construction measured thousand year whatever planet remained solar system would see dramatic maybe even catastrophic fall sunlight weather pattern carnage eco system collapse dyson sphere nonsense
"Some time ago a telescope observed something taking energy from our sun and there was many hypotheses commentary about that, is the only thing we can do about until nobody remembers the event it’s sad but…",time ago telescope observed something taking energy sun many hypothesis commentary thing nobody remembers event sad
"""Anything that uses a lot of energy produces a lot of heat"" is mentioned 11:04. But this isn't always the case—it depends on how efficiently the energy is converted into the intended form of work.

For example, electric heaters are designed to convert electrical energy directly into heat, so nearly all the energy becomes heat. However, LED lights or electric motors are much more efficient: they convert most of the energy into light or motion, respectively, with minimal heat loss. So while energy usage often correlates with heat production, the relationship depends on the efficiency and purpose of the device.",anything us lot energy produce lot heat mentioned isnt always caseit depends efficiently energy converted intended form work example electric heater designed convert electrical energy directly heat nearly energy becomes heat however led light electric motor much efficient convert energy light motion respectively minimal heat loss energy usage often correlate heat production relationship depends efficiency purpose device
13:35 overlay for triple crosss and death by star child operations CHL all else REDACTED. It never happened SAL AND HAL,overlay triple cross death star child operation chl else redacted never happened sal hal
And I thought Angelina Jolie was the most mysterious star in the Universe 😂🎉,thought angelina jolie mysterious star universe
"Ooh Okay Okay  Just Imagine Guy's My Personal Opinion I Know That Possible But  Just Imagine. One Day V R Cross That Observable Universe Border 
Warp Drive.
CryoSleep.",ooh okay okay imagine guy personal opinion know possible imagine one day v r cross observable universe border warp drive cryosleep
it could be a flat planet orbiting the star and giving irregular dips in the light when it's side on or flat on...,could flat planet orbiting star giving irregular dip light side flat
It’s all guesswork.They make up all kinds of nonsense.,guessworkthey make kind nonsense
"She's comfortable suggesting alien tech waaaaaay out there, but glides easily over our moons' creation with the common (flawed) hypothesis.
Interesting. 
I guess one can only handle so much.",shes comfortable suggesting alien tech waaaaaay glide easily moon creation common flawed hypothesis interesting guess one handle much
Maybe a Dyson Sphere?,maybe dyson sphere
"""Miles"".... Funny Americans",mile funny american
We spend all this time and money looking out there when all we needed to do was look within… iykyk,spend time money looking needed look within iykyk
Is she indicating Dyson spheres ?,indicating dyson sphere
I think anyone who knows and is anti Christian should be ashamed. It's evil. We are bringing God back.,think anyone know anti christian ashamed evil bringing god back
Jesus is the Greatest Superstar.,jesus greatest superstar
A spacestation for interstellar communications disguised as an Artificial Star... Like a Synthetic Programmable Starlight Generator or something like that??? ,spacestation interstellar communication disguised artificial star like synthetic programmable starlight generator something like
When I was a child I thought aliens would look like monsters until I realized we are aliens to everyone else in the universe.we are not the only human beings in the universe if you think we are that lucky you are just selfish!,child thought alien would look like monster realized alien everyone else universewe human being universe think lucky selfish
"For those who is skeptical about science, I must tell you something about science that you must unquestionably believe, that is science has always been proven wrong later on.  You can always believe that about science.",skeptical science must tell something science must unquestionably believe science always proven wrong later always believe science
Im the most simple star thats why u cant see it❤❤🎉🎉,im simple star thats u cant see
And this only picks up planets that are perfectly or near perfectly in alignment with earth and their sun!  This is only a slice in an endless cake.  Imagine all the ones that don't align!  Exponentially more exist,pick planet perfectly near perfectly alignment earth sun slice endless cake imagine one dont align exponentially exist
Couldn`t it simply be a giant planet with enormous moons orbiting it?,couldnt simply giant planet enormous moon orbiting
"All of you are a joke you make up something and run with it. Black energy, black matter, white holes. Stop with the lies. My all time favorite is the big bang. None of this is real. But you keep making money with your lies.",joke make something run black energy black matter white hole stop lie time favorite big bang none real keep making money lie
Is there any update subsequent to the JWST going into service?,update subsequent jwst going service
"I find it cute, as if an ant colony witnessed their first snowflake and the top scientist ants tell the others what it is as if they should know because... they are the top scientist ants. I myself am not any kind of scientist, but I do have great vision and imagination.",find cute ant colony witnessed first snowflake top scientist ant tell others know top scientist ant kind scientist great vision imagination
"Too long: strange patterns, many volunteers, in the end it's not aliens, they don't know what it is. And she is a bad speaker, weird pauses, bad tone, and in the end very little information.",long strange pattern many volunteer end alien dont know bad speaker weird pause bad tone end little information
"Earth is not eleven times smaller than Jupiter, its diameter is 11 times smaller. Very different things.",earth eleven time smaller jupiter diameter time smaller different thing
"Well, how about huge comet passed in between that star and earth but the comet is very far from that star that would abstruct great chunk of light from that star",well huge comet passed star earth comet far star would abstruct great chunk light star
My guess is the star is in a trinary star system with two black holes,guess star trinary star system two black hole
What if the readings were about multiple planets aligning in the line of sight of our Kepler telescope🧐,reading multiple planet aligning line sight kepler telescope
It's an amazing story,amazing story
This is NOT a worthy TED talk.  She admitted that she didn’t know what was causing the phenomenon and then goes on and on with her unsubstantiated theories.  Boo 😒 hiss.  🐍,worthy ted talk admitted didnt know causing phenomenon go unsubstantiated theory boo hiss
"Just some gas clouds passed the star, boring.",gas cloud passed star boring
"Prolly another solar system

The light is the sun there, & the light dips are the different planets eclipsing our view of the sun there",prolly another solar system light sun light dip different planet eclipsing view sun
"So, this passes for science?  Since when does TED Talks allow science fiction?",pass science since ted talk allow science fiction
"If the planets resources are exhausted, where did the resources for a Dysons  sphere come from? Mining other planets?",planet resource exhausted resource dysons sphere come mining planet
She sounds like she makes ambrosia salad without any raisins 😬,sound like make ambrosia salad without raisin
"How do you build a Dyson Sphere ""after"" you ""exhaust the energy supply of your home planet"" ?  And if you are so advanced that you know how to build a Dyson Sphere, how did you fail to only rely on reusable energy to avoid the need to build a Dyson Sphere in the first place?",build dyson sphere exhaust energy supply home planet advanced know build dyson sphere fail rely reusable energy avoid need build dyson sphere first place
I would rather focus on what is with in me😂,would rather focus
What if Tabby orbits a black hole? or is it slowly being eaten?,tabby orbit black hole slowly eaten
As a citizen of the Andromeda galaxy I can say yaelt very hae lll haà marmaloosas Xpress weeblatotsy pasht lamatooty,citizen andromeda galaxy say yaelt hae lll ha marmaloosas xpress weeblatotsy pasht lamatooty
There’s just lots of moons,there lot moon
when will these aliens will contact to me?? i mean i am hearing too much alien shts for decades from these fantasy scientists,alien contact mean hearing much alien shts decade fantasy scientist
Yeah okay...aliens...sure...smh,yeah okayalienssuresmh
Point Webb at it,point webb
"Several hypotheses have been proposed to explain the star's large irregular changes in brightness, but as of 2024, none of them fully explain all aspects of the resulting light curve.",several hypothesis proposed explain star large irregular change brightness none fully explain aspect resulting light curve
"A lot of you're probably wondering why does she look so familar. Well she has uncanny resemblance to Matt Servitto (Deputy Brock in Banshee, Gov. Bob Sweeney in the Billions).
You're welcome.",lot youre probably wondering look familar well uncanny resemblance matt servitto deputy brock banshee gov bob sweeney billion youre welcome
"Has anyone considered the possibility that this star has multiple planets and some of them cross the star at the same time causing more sunlight to be blocked and also extending the length of time that the light of blocked as well as the irregular dipping of the lights?  Even in our solar system we have planetary alignment.  Perhaps these alignments occur more frequently on that system, perhaps that star has maybe 20 planets orbiting it and perhaps they are not as far apart from one and other as our planets are.",anyone considered possibility star multiple planet cross star time causing sunlight blocked also extending length time light blocked well irregular dipping light even solar system planetary alignment perhaps alignment occur frequently system perhaps star maybe planet orbiting perhaps far apart one planet
not at all interested in the hypothetical after opening my that Carl quote,interested hypothetical opening carl quote
"So you are telling me that all these scientists and those 300,000 science enthusiasts could not think of the simple possibility that multiple planets could be passing in front of that star (not necessarily orbiting it) just by chance? I mean you are looking at a star so far away you can barely see the light of it, there can be so many other celestial objects passing in front of it and all you can think of is ""alien megastructures""... I wonder how many real scientist are out there these days and not just a bunch of nerds with PHDs...",telling scientist science enthusiast could think simple possibility multiple planet could passing front star necessarily orbiting chance mean looking star far away barely see light many celestial object passing front think alien megastructures wonder many real scientist day bunch nerd phd
Why can you not show the solar system as it really is??!!,show solar system really
And all this from nothing.....😉,nothing
Alien 👾 alert 🤯,alien alert
What a bimbo,bimbo
Is the star dying?,star dying
I'm not an Astronomer but what if there was more than one planet orbiting the Star but at different speeds? Only on occasions would the planets coincide and act in unison to block more significant amounts of light.,im astronomer one planet orbiting star different speed occasion would planet coincide act unison block significant amount light
